root@lamp-ubuntu-s-1vcpu-1gb-tor1-01:~# tcpdump -r 0001.pcap
reading from file 0001.pcap, link-type EN10MB (Ethernet)
21:18:37.697543 IP 159.203.9.125.ssh > ip-64-52-25-50.fibre.fibrestream.ca.62972: Flags [P.], seq 1773915183:1773915227, ack 2437540117, win 501, length 44
21:18:37.697610 IP 159.203.9.125.ssh > ip-64-52-25-50.fibre.fibrestream.ca.62972: Flags [P.], seq 44:152, ack 1, win 501, length 108
21:18:37.697652 IP 159.203.9.125.ssh > ip-64-52-25-50.fibre.fibrestream.ca.62972: Flags [P.], seq 152:188, ack 1, win 501, length 36
21:18:37.711127 IP ip-64-52-25-50.fibre.fibrestream.ca.62972 > 159.203.9.125.ssh: Flags [.], ack 44, win 4137, length 0
21:18:37.711168 IP ip-64-52-25-50.fibre.fibrestream.ca.62972 > 159.203.9.125.ssh: Flags [.], ack 188, win 4137, length 0
21:18:43.790880 IP ip-64-52-25-50.fibre.fibrestream.ca.62972 > 159.203.9.125.ssh: Flags [P.], seq 1:37, ack 188, win 4137, length 36
21:18:43.791106 IP 159.203.9.125.ssh > ip-64-52-25-50.fibre.fibrestream.ca.62972: Flags [P.], seq 188:224, ack 37, win 501, length 36
21:18:43.835256 IP ip-64-52-25-50.fibre.fibrestream.ca.62972 > 159.203.9.125.ssh: Flags [.], ack 224, win 4137, length 0
21:18:44.746466 IP ip-64-52-25-50.fibre.fibrestream.ca.62972 > 159.203.9.125.ssh: Flags [P.], seq 37:73, ack 224, win 4137, length 36
21:18:44.746654 IP 159.203.9.125.ssh > ip-64-52-25-50.fibre.fibrestream.ca.62972: Flags [P.], seq 224:268, ack 73, win 501, length 44
21:18:44.793861 IP ip-64-52-25-50.fibre.fibrestream.ca.62972 > 159.203.9.125.ssh: Flags [.], ack 268, win 4137, length 0
